<?xml version="1.1" encoding="UTF-8" standalone="no"?>

<evaluation xmlns:xsi="http://www.w3.org/2001/XMLSchema-instance"
    xsi:noNamespaceSchemaLocation="./Demo-Restriction.xsd" lesson="xml">
    <student>
        <firstname>Laurence</firstname>
        <lastname>Delforge</lastname>
        <email>del.lau@i3.be</email>
        <notes>
            <note date="2023-08-25">18.5</note>
        </notes>
    </student>
    <student>
        <firstname>Hanane</firstname>
        <lastname>Chyabri</lastname>
        <email>chy.han@i3.be</email>
        <notes>
            <note date="2023-08-25">18.5</note>
        </notes>
    </student>
</evaluation>